{
  "@id": "https://example.gov/attributions/dataset-steward-001",
  "@type": "Attribution",
  "hadRole": "Data Steward",
  "agent": {
    "@id": "https://example.gov/agents/env-data-office-001",
    "@type": "Agent",
    "name": "Environmental Data Management Office",
    "category": [
      {
        "@id": "https://example.gov/concepts/government-office",
        "@type": "Concept",
        "prefLabel": "Government Office",
        "definition": "A subdivision of a government agency responsible for specific functions.",
        "inScheme": "https://example.gov/concept-schemes/organization-types"
      }
    ]
  }
}
